{
  "$schema": "https://json-schema.org/draft/2020-12/schema",
  "title": "auto-dao session state",
  "description": "Authoritative session state for a learning session. All other Markdown status files are derived views.",
  "type": "object",
  "required": [
    "schema_version",
    "topic_id",
    "source_path",
    "phase",
    "current_lesson",
    "total_lessons",
    "created_at",
    "updated_at"
  ],
  "properties": {
    "schema_version": {
      "const": "2.0"
    },
    "topic_id": {
      "type": "string",
      "minLength": 1,
      "description": "Human-readable topic identifier, e.g. 'stm32-hal'"
    },
    "source_path": {
      "type": "string",
      "description": "Path to the original learning material"
    },
    "processed_path": {
      "type": "string",
      "description": "Path to the Markdown-converted material (empty if source is already Markdown)"
    },
    "source_hash": {
      "type": "string",
      "description": "SHA-256 hex digest of the source file, used to detect material changes"
    },
    "phase": {
      "type": "string",
      "enum": ["init", "preprocessing", "learning", "review", "completed"],
      "description": "Current pipeline phase"
    },
    "current_lesson": {
      "type": "integer",
      "minimum": 0,
      "description": "Next lesson to generate or current lesson in progress"
    },
    "total_lessons": {
      "type": "integer",
      "minimum": 0,
      "description": "Planned total number of lessons from roadmap"
    },
    "last_completed_lesson": {
      "type": "integer",
      "minimum": 0,
      "description": "Index of the last fully graded lesson"
    },
    "mastery_passed": {
      "type": "integer",
      "minimum": 0,
      "description": "Cumulative count of correctly answered questions"
    },
    "mastery_failed": {
      "type": "integer",
      "minimum": 0,
      "description": "Cumulative count of incorrectly answered questions"
    },
    "mastery_rate": {
      "type": "number",
      "minimum": 0,
      "maximum": 1,
      "description": "mastery_passed / (mastery_passed + mastery_failed), 0 when no data"
    },
    "counterfactual_mode": {
      "type": ["string", "null"],
      "enum": ["on", "off", "auto", null],
      "description": "Counterfactual reasoning mode. null = not yet decided (will prompt user)"
    },
    "learning_language": {
      "type": "string",
      "description": "ISO 639-1 code for the teaching language, e.g. 'zh', 'en'. Empty = same as material language"
    },
    "wait_reason": {
      "type": ["string", "null"],
      "enum": ["awaiting_answer", "awaiting_grading", "awaiting_user_choice", null],
      "description": "Why the session is blocked, null when not blocked"
    },
    "created_at": {
      "type": "string",
      "format": "date-time",
      "description": "ISO 8601 timestamp of session creation"
    },
    "updated_at": {
      "type": "string",
      "format": "date-time",
      "description": "ISO 8601 timestamp of last state update"
    }
  },
  "additionalProperties": false
}
