{
  "schema_version": "2.0",
  "topic_id": "",
  "source_path": "",
  "processed_path": "",
  "source_hash": "",
  "phase": "init",
  "current_lesson": 0,
  "total_lessons": 0,
  "last_completed_lesson": 0,
  "mastery_passed": 0,
  "mastery_failed": 0,
  "mastery_rate": 0.0,
  "counterfactual_mode": null,
  "learning_language": "",
  "wait_reason": null,
  "created_at": "",
  "updated_at": ""
}
